{
  "command_id": "cmd-kata-kernel-size",
  "exit_status": 0,
  "finished_at": "2026-07-22T13:24:16Z",
  "raw_stderr_sha256": "e3b0c44298fc1c149afbf4c8996fb92427ae41e4649b934ca495991b7852b855",
  "raw_stdout_sha256": "5e5544c315466ada9f2149eaa3e016eb51c8e262c529c4ed95c14d1d96ca9e93",
  "result": "PASS",
  "sanitized_arguments": [
    "<tool>",
    "-c",
    "'~/.cache/codex-runtimes/codex-primary-runtime/dependencies/native/poppler/poppler/bin/zstd' -dc '<kata_archive>' | tar -xOf - 'opt/kata/share/kata-containers/vmlinux-6.18.15-186' | wc -c"
  ],
  "sanitized_stderr": "",
  "sanitized_stdout": " 16151040\n",
  "schema_version": "pankster.phase1b-b0.command-evidence.v1",
  "started_at": "2026-07-22T13:24:15Z",
  "subject_artifact_sha256": "f63d54507d1f18635d94475077e4c2330de4d8e05cedf25f7c38f063b0e66a91",
  "subject_artifact_size_bytes": 596775193,
  "tool": "/bin/sh",
  "tool_version": "GNU bash, version 3.2.57(1)-release (arm64-apple-darwin25)"
}
