{
  "command_id": "cmd-existing-zstd-version",
  "exit_status": 0,
  "finished_at": "2026-07-22T13:24:12Z",
  "raw_stderr_sha256": "e3b0c44298fc1c149afbf4c8996fb92427ae41e4649b934ca495991b7852b855",
  "raw_stdout_sha256": "f6d344e585f9a9ceb9500ff65355ce23bcc39dec9e4164aceab9da0a5ac3113e",
  "result": "PASS",
  "sanitized_arguments": [
    "<tool>",
    "--version"
  ],
  "sanitized_stderr": "",
  "sanitized_stdout": "*** Zstandard CLI (64-bit) v1.5.7, by Yann Collet ***\n",
  "schema_version": "pankster.phase1b-b0.command-evidence.v1",
  "started_at": "2026-07-22T13:24:12Z",
  "subject_artifact_sha256": "f63d54507d1f18635d94475077e4c2330de4d8e05cedf25f7c38f063b0e66a91",
  "subject_artifact_size_bytes": 596775193,
  "tool": "~/.cache/codex-runtimes/codex-primary-runtime/dependencies/native/poppler/poppler/bin/zstd",
  "tool_version": "*** Zstandard CLI (64-bit) v1.5.7, by Yann Collet ***"
}
