{
  "command_id": "cmd-kata-archive-list-target",
  "exit_status": 0,
  "finished_at": "2026-07-22T13:24:13Z",
  "raw_stderr_sha256": "e3b0c44298fc1c149afbf4c8996fb92427ae41e4649b934ca495991b7852b855",
  "raw_stdout_sha256": "ccc54e968523c942549aba452dfde96a579260956dd829996ce191c8eb989cad",
  "result": "PASS",
  "sanitized_arguments": [
    "<tool>",
    "-c",
    "'~/.cache/codex-runtimes/codex-primary-runtime/dependencies/native/poppler/poppler/bin/zstd' -dc '<kata_archive>' | tar -tf - 'opt/kata/share/kata-containers/vmlinux-6.18.15-186'"
  ],
  "sanitized_stderr": "",
  "sanitized_stdout": "./opt/kata/share/kata-containers/vmlinux-6.18.15-186\n",
  "schema_version": "pankster.phase1b-b0.command-evidence.v1",
  "started_at": "2026-07-22T13:24:12Z",
  "subject_artifact_sha256": "f63d54507d1f18635d94475077e4c2330de4d8e05cedf25f7c38f063b0e66a91",
  "subject_artifact_size_bytes": 596775193,
  "tool": "/bin/sh",
  "tool_version": "GNU bash, version 3.2.57(1)-release (arm64-apple-darwin25)"
}
