{
  "command_id": "cmd-xar-version",
  "exit_status": 0,
  "finished_at": "2026-07-22T13:03:49Z",
  "raw_stderr_sha256": "e3b0c44298fc1c149afbf4c8996fb92427ae41e4649b934ca495991b7852b855",
  "raw_stdout_sha256": "b90ef4cede6737015a8c4e8374c57f79fb557ff849b2bd7aaaaaa5c27a61a709",
  "result": "PASS",
  "sanitized_arguments": [
    "<tool>",
    "--version"
  ],
  "sanitized_stderr": "",
  "sanitized_stdout": "xar 1.8dev\n",
  "schema_version": "pankster.phase1b-b0.command-evidence.v1",
  "started_at": "2026-07-22T13:03:49Z",
  "subject_artifact_sha256": "not_applicable",
  "subject_artifact_size_bytes": "not_applicable",
  "tool": "xar",
  "tool_version": "xar 1.8dev"
}
