{
  "command_id": "cmd-python-zstandard-import",
  "exit_status": 1,
  "finished_at": "2026-07-22T13:03:49Z",
  "raw_stderr_sha256": "3472d252cc12fe6c376f3efc5cccb1acc33807da391338e661153974a29b9326",
  "raw_stdout_sha256": "e3b0c44298fc1c149afbf4c8996fb92427ae41e4649b934ca495991b7852b855",
  "result": "BLOCKED_KATA_ARCHIVE_INSPECTION_CAPABILITY_UNAVAILABLE",
  "sanitized_arguments": [
    "<tool>",
    "-c",
    "import zstandard; print('available')"
  ],
  "sanitized_stderr": "Traceback (most recent call last):\n  File \"<string>\", line 1, in <module>\n    import zstandard; print('available')\n    ^^^^^^^^^^^^^^^^\nModuleNotFoundError: No module named 'zstandard'\n",
  "sanitized_stdout": "",
  "schema_version": "pankster.phase1b-b0.command-evidence.v1",
  "started_at": "2026-07-22T13:03:49Z",
  "subject_artifact_sha256": "not_applicable",
  "subject_artifact_size_bytes": "not_applicable",
  "tool": "python3",
  "tool_version": "Python 3.14.5"
}
